phecode,description,phecode_exclude_range,sex,rollup,leaf,groupnum,group,color,phecode_exclude_description,n_cases,n_controls
627.5,Premature menopause and other ovarian failure,626-628.99,Female,1,1,11,genitourinary,black," menstrual/menopausal disorders, female infertility",47,189837
628,Ovarian cyst,626-628.99,Female,1,1,11,genitourinary,black," menstrual/menopausal disorders, female infertility",4777,189837
634,Miscarriage; stillbirth,634-636.99,Female,1,0,12,pregnancy complications,royalblue4,complications of pregnancy,5462,212919
634.1,Missed abortion/Hydatidiform mole,634-636.99,Female,1,1,12,pregnancy complications,royalblue4,complications of pregnancy,1251,212919
634.3,Ectopic pregnancy,634-636.99,Female,1,1,12,pregnancy complications,royalblue4,complications of pregnancy,331,212919
635,Hemorrhage during pregnancy; childbirth and postpartum,634-636.99,Female,1,0,12,pregnancy complications,royalblue4,complications of pregnancy,2005,212919
635.2,"Antepartum hemorrhage, abruptio placentae, and placenta previa",634-636.99,Female,1,1,12,pregnancy complications,royalblue4,complications of pregnancy,866,212919
635.3,Placenta previa and abruptio placenta,634-636.99,Female,1,1,12,pregnancy complications,royalblue4,complications of pregnancy,1274,212919
636,Early or threatened labor; hemorrhage in early pregnancy,634-636.99,Female,1,0,12,pregnancy complications,royalblue4,complications of pregnancy,2558,212919
636.2,Early onset of delivery,634-636.99,Female,1,1,12,pregnancy complications,royalblue4,complications of pregnancy,617,212919
636.3,Hemorrhage in early pregnancy,634-636.99,Female,1,1,12,pregnancy complications,royalblue4,complications of pregnancy,1083,212919
636.8,Cervical incompetence,634-636.99,Female,1,1,12,pregnancy complications,royalblue4,complications of pregnancy,32,212919
637,Short gestation; low birth weight; and fetal growth retardation,634-639.99,Both,1,1,12,pregnancy complications,royalblue4," miscarriage, early labor, hemorrhage",3,400906
638,Other high-risk pregnancy,634-639.99,Female,1,0,12,pregnancy complications,royalblue4," miscarriage, early labor, hemorrhage",70,212885
639,Complications following abortion or ectopic and molar pregnancies,634-639.99,Female,1,0,12,pregnancy complications,royalblue4," miscarriage, early labor, hemorrhage",48,212885
642,"Hypertension complicating pregnancy, childbirth, and the puerperium",642-642.99,Female,1,0,12,pregnancy complications,royalblue4," Hypertension complicating pregnancy, childbirth, and the puerperium",1114,219819
642.1,Preeclampsia and eclampsia,642-642.99,Female,1,1,12,pregnancy complications,royalblue4," Hypertension complicating pregnancy, childbirth, and the puerperium",307,219819
643,Excessive vomiting in pregnancy,643-643.99,Female,1,0,12,pregnancy complications,royalblue4,Excessive vomiting in pregnancy,230,220703
643.1,Hyperemesis gravidarum,643-643.99,Female,1,1,12,pregnancy complications,royalblue4,Excessive vomiting in pregnancy,153,220703
644,Anemia during pregnancy,644-644.99,Female,1,1,12,pregnancy complications,royalblue4, Anemia during pregnancy,1,220932
645,Late pregnancy and failed induction,645-645.99,Female,1,0,12,pregnancy complications,royalblue4, Late pregnancy and failed induction,1256,219677
646,Other complications of pregnancy NEC,646-646.99,Female,1,1,12,pregnancy complications,royalblue4, Other complications of pregnancy NEC,2234,218699
647,Infectious and parasitic complications affecting pregnancy,647-647.99,Female,1,1,12,pregnancy complications,royalblue4, Infectious and parasitic complications affecting pregnancy,68,220552
647.1,Infections of genitourinary tract during pregnancy,647-647.99,Female,0,1,12,pregnancy complications,royalblue4, Infectious and parasitic complications affecting pregnancy,275,220552
647.3,Major puerperal infection,647-647.99,Female,0,1,12,pregnancy complications,royalblue4, Infectious and parasitic complications affecting pregnancy,45,220552
649,"Other conditions or status of the mother complicating pregnancy, childbirth, or the puerperium",649-649.99,Female,1,1,12,pregnancy complications,royalblue4," Other conditions or status of the mother complicating pregnancy, childbirth, or the puerperium",113,220634
649.1,Diabetes or abnormal glucose tolerance complicating pregnancy,649-649.99,Female,0,1,12,pregnancy complications,royalblue4," Other conditions or status of the mother complicating pregnancy, childbirth, or the puerperium",193,220634
650,Normal delivery,650-650.99,Female,1,0,12,pregnancy complications,royalblue4,Normal delivery,1928,219005
651,Multiple gestation,651-651.99,Female,1,0,12,pregnancy complications,royalblue4,Multiple gestation,346,220587
652,Malposition and malpresentation of fetus or obstruction,652-654.99,Female,1,0,12,pregnancy complications,royalblue4,Other and unspecified complications of birth affecting mother,1719,217967
653,Problems associated with amniotic cavity and membranes,652-654.99,Female,1,1,12,pregnancy complications,royalblue4,Other and unspecified complications of birth affecting mother,1404,217967
654,Other and unspecified complications of birth; puerperium affecting management of mother,652-654.99,Female,1,1,12,pregnancy complications,royalblue4,Other and unspecified complications of birth affecting mother,74,217967
654.1,"Abnormality of organs and soft tissues of pelvis complicating pregnancy, childbirth, or the puerperium",652-654.99,Female,0,1,12,pregnancy complications,royalblue4,Other and unspecified complications of birth affecting mother,47,217967
654.2,Rhesus isoimmunization in pregnancy,652-654.99,Female,0,1,12,pregnancy complications,royalblue4,Other and unspecified complications of birth affecting mother,25,217967
655,Known or suspected fetal abnormality affecting management of mother,655-655.99,Female,1,0,12,pregnancy complications,royalblue4,Known or suspected fetal abnormality (mother),4325,216608
656,Other perinatal conditions of fetus or newborn,656-656.99,Both,1,0,12,pregnancy complications,royalblue4,Other and unspecified perinatal conditions,110,408849
656.2,Respiratory conditions of fetus and newborn,656-656.99,Both,1,0,12,pregnancy complications,royalblue4,Other and unspecified perinatal conditions,2,408849
656.22,Interstitial emphysema and related conditions of newborn,656-656.99,Both,1,1,12,pregnancy complications,royalblue4,Other and unspecified perinatal conditions,0,408849
656.26,Transitory tachypnea or apnea of newborn,656-656.99,Both,1,1,12,pregnancy complications,royalblue4,Other and unspecified perinatal conditions,2,408849
656.3,Endocrine and metabolic disturbances of fetus and newborn,656-656.99,Both,1,1,12,pregnancy complications,royalblue4,Other and unspecified perinatal conditions,0,408849
656.5,Hematological disorders of newborn,656-656.99,Both,1,1,12,pregnancy complications,royalblue4,Other and unspecified perinatal conditions,1,408849
656.7,Conditions involving the integument and temperature regulation of fetus and newborn,656-656.99,Both,1,1,12,pregnancy complications,royalblue4,Other and unspecified perinatal conditions,3,408849
656.8,Perinatal jaundice,656-656.99,Both,1,1,12,pregnancy complications,royalblue4,Other and unspecified perinatal conditions,0,408849
657,Infections specific to the perinatal period,657-657.99,Both,1,1,12,pregnancy complications,royalblue4,Infections specific to the perinatal period,4,408955
658,Maternal complication of pregnancy affecting fetus or newborn,658-658.99,Female,1,0,12,pregnancy complications,royalblue4,Maternal complication of pregnancy affecting fetus or newborn,4,220929
661,Fetal distress and abnormal forces of labor,660-669.99,Female,1,0,12,pregnancy complications,royalblue4,COMPLICATIONS OCCURRING MAINLY IN THE COURSE OF LABOR AND DELIVERY,2272,213009
663,Umbilical cord complications during labor and delivery,660-669.99,Female,1,0,12,pregnancy complications,royalblue4,COMPLICATIONS OCCURRING MAINLY IN THE COURSE OF LABOR AND DELIVERY,533,213009
665,Obstetrical/birth trauma,660-669.99,Female,1,0,12,pregnancy complications,royalblue4,COMPLICATIONS OCCURRING MAINLY IN THE COURSE OF LABOR AND DELIVERY,5335,213009
668,Complications of the administration of anesthetic or other sedation in labor and delivery,660-669.99,Female,1,0,12,pregnancy complications,royalblue4,COMPLICATIONS OCCURRING MAINLY IN THE COURSE OF LABOR AND DELIVERY,45,213009
669,Complications of labor and delivery NEC,660-669.99,Female,1,1,12,pregnancy complications,royalblue4,COMPLICATIONS OCCURRING MAINLY IN THE COURSE OF LABOR AND DELIVERY,2559,213009
671,Venous/cerebrovascular complications embolism in pregnancy and the puerperium,670-677.99,Female,1,1,12,pregnancy complications,royalblue4,COMPLICATIONS OF THE PUERPERIUM,164,220453
674,Other complications of the puerperium NEC,670-677.99,Female,1,1,12,pregnancy complications,royalblue4,COMPLICATIONS OF THE PUERPERIUM,262,220453
676,Other disorders of the breast associated with childbirth and disorders of lactation,670-677.99,Female,1,1,12,pregnancy complications,royalblue4,COMPLICATIONS OF THE PUERPERIUM,63,220453
679,Complications of in utero procedures,678-679.99,Female,1,0,13,dermatologic,firebrick,OTHER MATERNAL AND FETAL COMPLICATIONS,53,220880
681,Superficial cellulitis and abscess,680-686.99,Both,1,0,13,dermatologic,firebrick, Skin and subcutaneous tissue infections,7457,397626
681.1,Cellulitis and abscess of fingers/toes,680-686.99,Both,1,1,13,dermatologic,firebrick, Skin and subcutaneous tissue infections,566,397626
681.2,Cellulitis and abscess of face/neck,680-686.99,Both,1,1,13,dermatologic,firebrick, Skin and subcutaneous tissue infections,524,397626
681.3,Cellulitis and abscess of arm/hand,680-686.99,Both,1,1,13,dermatologic,firebrick, Skin and subcutaneous tissue infections,5542,397626
681.5,"Cellulitis and abscess of leg, except foot",680-686.99,Both,1,1,13,dermatologic,firebrick, Skin and subcutaneous tissue infections,5550,397626
681.6,"Cellulitis and abscess of foot, toe",680-686.99,Both,1,1,13,dermatologic,firebrick, Skin and subcutaneous tissue infections,5505,397626
681.7,Cellulitis and abscess of trunk,680-686.99,Both,1,1,13,dermatologic,firebrick, Skin and subcutaneous tissue infections,602,397626
686,Other local infections of skin and subcutaneous tissue,680-686.99,Both,1,1,13,dermatologic,firebrick, Skin and subcutaneous tissue infections,1349,397626
686.1,Carbuncle and furuncle,680-686.99,Both,0,1,13,dermatologic,firebrick, Skin and subcutaneous tissue infections,2303,397626
686.2,Impetigo,680-686.99,Both,0,1,13,dermatologic,firebrick, Skin and subcutaneous tissue infections,28,397626
686.3,Pilonidal cyst,680-686.99,Both,0,1,13,dermatologic,firebrick, Skin and subcutaneous tissue infections,587,397626
686.4,Pyogenic granuloma,680-686.99,Both,0,1,13,dermatologic,firebrick, Skin and subcutaneous tissue infections,362,397626
686.5,Pyoderma,680-686.99,Both,0,1,13,dermatologic,firebrick, Skin and subcutaneous tissue infections,42,397626
687,Symptoms affecting skin,687-687.99,Both,1,0,13,dermatologic,firebrick, Symptoms affecting skin,604,403405
687.1,Rash and other nonspecific skin eruption,687-687.99,Both,0,1,13,dermatologic,firebrick, Symptoms affecting skin,2157,403405
687.2,"Localized superficial swelling, mass, or lump",687-687.99,Both,1,0,13,dermatologic,firebrick, Symptoms affecting skin,284,403405
687.3,Changes in skin texture,687-687.99,Both,1,1,13,dermatologic,firebrick, Symptoms affecting skin,108,403405
687.4,Disturbance of skin sensation,687-687.99,Both,0,1,13,dermatologic,firebrick, Symptoms affecting skin,2900,403405
689,Disorder of skin and subcutaneous tissue NOS,689-689.99,Both,1,1,13,dermatologic,firebrick, Other skin disorders NOS,5783,403176
690,Erythematosquamous dermatosis,690-697.99,Both,1,0,13,dermatologic,firebrick, Other inflammatory condition of skin,72,402667
690.1,Seborrheic dermatitis,690-697.99,Both,1,1,13,dermatologic,firebrick, Other inflammatory condition of skin,53,402667
691,Congenital anomalies of skin,690-697.99,Both,1,0,13,dermatologic,firebrick, Other inflammatory condition of skin,120,402667
691.1,Ichthyosis congenita,690-697.99,Both,1,1,13,dermatologic,firebrick, Other inflammatory condition of skin,10,402667
691.3,Congenital pigmentary anomalies of skin,690-697.99,Both,1,1,13,dermatologic,firebrick, Other inflammatory condition of skin,22,402667
694,Dyschromia and Vitiligo,690-697.99,Both,1,0,13,dermatologic,firebrick, Other inflammatory condition of skin,987,402667
694.1,Vitiligo,690-697.99,Both,1,1,13,dermatologic,firebrick, Other inflammatory condition of skin,60,402667
694.2,Other dyschromia,690-697.99,Both,1,1,13,dermatologic,firebrick, Other inflammatory condition of skin,783,402667
694.3,Vascular disorders of skin,690-697.99,Both,1,1,13,dermatologic,firebrick, Other inflammatory condition of skin,117,402667
695,Erythematous conditions,690-697.99,Both,1,0,13,dermatologic,firebrick, Other inflammatory condition of skin,2420,402667
695.1,Toxic erythema,690-697.99,Both,1,1,13,dermatologic,firebrick, Other inflammatory condition of skin,109,402667
695.2,Bullous dermatoses,690-697.99,Both,1,0,13,dermatologic,firebrick, Other inflammatory condition of skin,141,402667
695.21,Dermatitis herpetiformis,690-697.99,Both,1,1,13,dermatologic,firebrick, Other inflammatory condition of skin,57,402667
695.22,Pemphigus and pemphigoid,690-697.99,Both,1,1,13,dermatologic,firebrick, Other inflammatory condition of skin,75,402667
695.3,Rosacea,690-697.99,Both,1,1,13,dermatologic,firebrick, Other inflammatory condition of skin,310,402667
695.4,Lupus (localized and systemic),"690-697.99, 335-335.99",Both,1,0,13,dermatologic,firebrick," other inflammatory condition of skin, MS",418,401359
695.41,Cutaneous lupus erythematosus,"690-697.99, 335-335.99",Both,1,1,13,dermatologic,firebrick," other inflammatory condition of skin, MS",130,401359
695.42,Systemic lupus erythematosus,"690-697.99, 335-335.99",Both,1,1,13,dermatologic,firebrick," other inflammatory condition of skin, MS",342,401359
695.7,Prurigo and Lichen,690-697.99,Both,1,1,13,dermatologic,firebrick, Other inflammatory condition of skin,779,402667
695.8,Other specified erythematous conditions,690-697.99,Both,1,0,13,dermatologic,firebrick, Other inflammatory condition of skin,244,402667
695.81,Erythema nodosum,690-697.99,Both,1,1,13,dermatologic,firebrick, Other inflammatory condition of skin,76,402667
695.9,Unspecified erythematous condition,690-697.99,Both,1,1,13,dermatologic,firebrick, Other inflammatory condition of skin,468,402667
696,Psoriasis and related disorders,"690-697.99, 714-714.99",Both,1,0,13,dermatologic,firebrick,,2293,398193
696.2,Parapsoriasis,690-697.99,Both,1,1,13,dermatologic,firebrick, Other inflammatory condition of skin,18,402667
696.3,Pityriasis,690-697.99,Both,1,1,13,dermatologic,firebrick, Other inflammatory condition of skin,47,402667
696.4,Psoriasis,"690-697.99, 714-714.99",Both,1,0,13,dermatologic,firebrick,,2237,398193
696.41,Psoriasis vulgaris,"690-697.99, 714-714.99",Both,1,1,13,dermatologic,firebrick,,1684,398193
696.42,Psoriatic arthropathy,"690-697.99, 714-714.99",Both,1,1,13,dermatologic,firebrick,,708,398193
697,Sarcoidosis,690-697.99,Both,1,1,13,dermatologic,firebrick, Other inflammatory condition of skin,551,402667
698,Pruritus and related conditions,698-699.99,Both,1,1,13,dermatologic,firebrick, Pruritic conditions,783,408176
700,Corns and callosities,700-701.99,Both,1,1,13,dermatologic,firebrick, hypertrophic skin conditions,293,403874
701,Other hypertrophic and atrophic conditions of skin,700-701.99,Both,1,0,13,dermatologic,firebrick, hypertrophic skin conditions,4803,403874
701.1,"Keratoderma, acquired",700-701.99,Both,1,1,13,dermatologic,firebrick, hypertrophic skin conditions,87,403874
701.2,Scar conditions and fibrosis of skin,700-701.99,Both,1,1,13,dermatologic,firebrick, hypertrophic skin conditions,2355,403874
701.3,Circumscribed scleroderma,700-701.99,Both,1,1,13,dermatologic,firebrick, hypertrophic skin conditions,61,403874
701.4,Keloid scar,700-701.99,Both,1,1,13,dermatologic,firebrick, hypertrophic skin conditions,216,403874
701.5,Abnormal granulation tissue,700-701.99,Both,1,1,13,dermatologic,firebrick, hypertrophic skin conditions,457,403874
701.6,Acquired acanthosis nigricans,700-701.99,Both,1,1,13,dermatologic,firebrick, hypertrophic skin conditions,102,403874
702,Degenerative skin conditions and other dermatoses,700-702.99,Both,1,0,13,dermatologic,firebrick, Other hypertrophic and atrophic conditions of skin,5522,398745
702.1,Actinic keratosis,702-702.99,Both,1,1,13,dermatologic,firebrick,,2594,403437
702.2,Seborrheic keratosis,702-702.99,Both,1,1,13,dermatologic,firebrick,,3092,403437
702.4,Degenerative skin disorders,700-702.99,Both,1,1,13,dermatologic,firebrick, Other hypertrophic and atrophic conditions of skin,5,398745
703,"Diseases of nail, NOS",703-704.99,Both,1,1,13,dermatologic,firebrick, Diseases of hair and nails,355,402355
703.1,Ingrowing nail,703-704.99,Both,0,1,13,dermatologic,firebrick, Diseases of hair and nails,970,402355
704,Diseases of hair and hair follicles,703-704.99,Both,1,0,13,dermatologic,firebrick, Diseases of hair and nails,5315,402355
704.1,Alopecia,703-704.99,Both,1,0,13,dermatologic,firebrick, Diseases of hair and nails,127,402355
704.11,Alopecia Areata,703-704.99,Both,1,1,13,dermatologic,firebrick, Diseases of hair and nails,13,402355
704.2,Hirsutism,703-704.99,Both,0,1,13,dermatologic,firebrick, Diseases of hair and nails,31,402355
704.8,Other specified diseases of hair and hair follicles,703-704.99,Both,1,1,13,dermatologic,firebrick, Diseases of hair and nails,76,402355
705,Disorders of sweat glands,705-706.99,Both,1,0,13,dermatologic,firebrick, disorders of sweat and sebaceous glands,229,399253
705.1,Dyshidrosis,705-706.99,Both,1,1,13,dermatologic,firebrick, disorders of sweat and sebaceous glands,11,399253
705.3,Hidradenitis,705-706.99,Both,1,1,13,dermatologic,firebrick, disorders of sweat and sebaceous glands,187,399253
705.8,Hyperhidrosis,705-706.99,Both,0,1,13,dermatologic,firebrick, disorders of sweat and sebaceous glands,592,399253
706,Diseases of sebaceous glands,705-706.99,Both,1,0,13,dermatologic,firebrick, disorders of sweat and sebaceous glands,8948,399253
706.1,Acne,705-706.99,Both,1,1,13,dermatologic,firebrick, disorders of sweat and sebaceous glands,78,399253
706.2,Sebaceous cyst,705-706.99,Both,1,1,13,dermatologic,firebrick, disorders of sweat and sebaceous glands,8876,399253
706.8,Other specified diseases of sebaceous glands,705-706.99,Both,1,1,13,dermatologic,firebrick, disorders of sweat and sebaceous glands,2,399253
707,Chronic ulcer of skin,707-707.99,Both,1,0,13,dermatologic,firebrick, Chronic ulcer of skin,1992,406967
707.1,Decubitus ulcer,707-707.99,Both,1,1,13,dermatologic,firebrick, Chronic ulcer of skin,915,406967
707.2,Chronic ulcer of leg or foot,707-707.99,Both,1,1,13,dermatologic,firebrick, Chronic ulcer of skin,5,406967
707.3,Chronic ulcer of unspecified site,707-707.99,Both,1,1,13,dermatologic,firebrick, Chronic ulcer of skin,3,406967
709,Diffuse diseases of connective tissue,"690-697.99, 708-709.99",Both,1,0,13,dermatologic,firebrick,,3467,399395
709.2,Sicca syndrome,"690-697.99, 708-709.99",Both,1,1,13,dermatologic,firebrick,,513,399395
709.3,Systemic sclerosis,"690-697.99, 708-709.99",Both,1,1,13,dermatologic,firebrick,,176,399395
709.4,Polymyositis,"690-697.99, 708-709.99",Both,1,1,13,dermatologic,firebrick,,41,399395
709.5,Dermatomyositis,"690-697.99, 708-709.99",Both,1,1,13,dermatologic,firebrick,,47,399395
709.6,Other specified diffuse diseases of connective tissue,"690-697.99, 708-709.99",Both,1,1,13,dermatologic,firebrick,,65,399395
709.7,Unspecified diffuse connective tissue disease,"690-697.99, 708-709.99",Both,1,1,13,dermatologic,firebrick,,2727,399395
710,"Osteomyelitis, periostitis, and other infections involving bone",710-716.99,Both,1,0,14,musculoskeletal,darkolivegreen,Arthropathies,613,365805
710.1,Osteomyelitis,710-716.99,Both,1,0,14,musculoskeletal,darkolivegreen,Arthropathies,566,365805
710.11,Acute osteomyelitis,710-716.99,Both,1,1,14,musculoskeletal,darkolivegreen,Arthropathies,27,365805
710.12,Chronic osteomyelitis,710-716.99,Both,1,1,14,musculoskeletal,darkolivegreen,Arthropathies,196,365805
710.19,Unspecified osteomyelitis,710-716.99,Both,1,1,14,musculoskeletal,darkolivegreen,Arthropathies,402,365805
710.3,Osteopathy resulting from poliomyelitis,710-716.99,Both,1,1,14,musculoskeletal,darkolivegreen,Arthropathies,13,365805
711,Arthropathy associated with infections,710-716.99,Both,1,0,14,musculoskeletal,darkolivegreen,Arthropathies,429,365805
711.1,Pyogenic arthritis,710-716.99,Both,1,1,14,musculoskeletal,darkolivegreen,Arthropathies,330,365805
711.2,Reiter's disease,710-716.99,Both,1,1,14,musculoskeletal,darkolivegreen,Arthropathies,46,365805
711.3,Behcet's syndrome,710-716.99,Both,1,1,14,musculoskeletal,darkolivegreen,Arthropathies,25,365805
712,Infective connective tissue disorders,710-716.99,Both,1,1,14,musculoskeletal,darkolivegreen,Arthropathies,82,365805
713,Arthropathy associated with other disorders classified elsewhere,710-716.99,Both,1,0,14,musculoskeletal,darkolivegreen,Arthropathies,151,365805
713.5,Arthropathy associated with neurological disorders,710-716.99,Both,1,1,14,musculoskeletal,darkolivegreen,Arthropathies,68,365805
714,Rheumatoid arthritis and other inflammatory polyarthropathies,"714-716.00, 696-696.99",Both,1,0,14,musculoskeletal,darkolivegreen, Autoimmune arthritis and psoriasis,4882,365074
714.1,Rheumatoid arthritis,"714-716.00, 696-696.99",Both,1,1,14,musculoskeletal,darkolivegreen, Autoimmune arthritis and psoriasis,4415,365074
714.2,Juvenile rheumatoid arthritis,"714-716.00, 696-696.99",Both,1,1,14,musculoskeletal,darkolivegreen, Autoimmune arthritis and psoriasis,39,365074
715,Other inflammatory spondylopathies,"714-716.00, 696-696.99",Both,1,0,14,musculoskeletal,darkolivegreen, Autoimmune arthritis and psoriasis,1671,365074
715.1,Sacroiliitis NEC,"714-716.00, 696-696.99",Both,1,1,14,musculoskeletal,darkolivegreen, Autoimmune arthritis and psoriasis,113,365074
715.2,Ankylosing spondylitis,"714-716.00, 696-696.99",Both,1,1,14,musculoskeletal,darkolivegreen, Autoimmune arthritis and psoriasis,620,365074
715.3,Spinal enthesopathy,"714-716.00, 696-696.99",Both,1,1,14,musculoskeletal,darkolivegreen, Autoimmune arthritis and psoriasis,22,365074
716,Other arthropathies,710-716.99,Both,1,0,14,musculoskeletal,darkolivegreen,Arthropathies,38723,365805
716.1,Unspecified polyarthropathy or polyarthritis,710-716.99,Both,1,1,14,musculoskeletal,darkolivegreen,Arthropathies,3535,365805
716.2,Unspecified monoarthritis,710-716.99,Both,1,1,14,musculoskeletal,darkolivegreen,Arthropathies,15789,365805
716.8,Palindromic rheumatism,710-716.99,Both,1,1,14,musculoskeletal,darkolivegreen,Arthropathies,43,365805
716.9,Arthropathy NOS,710-716.99,Both,1,1,14,musculoskeletal,darkolivegreen,Arthropathies,37052,365805
717,Polymyalgia Rheumatica,717-717.99,Both,1,1,14,musculoskeletal,darkolivegreen, Osteoarthritis,1154,407805
720,Spinal stenosis,720-724.99,Both,1,0,14,musculoskeletal,darkolivegreen,DORSOPATHIES,3735,391910
721,Spondylosis and allied disorders,720-724.99,Both,1,0,14,musculoskeletal,darkolivegreen,DORSOPATHIES,7932,391910
721.1,Spondylosis without myelopathy,720-724.99,Both,1,1,14,musculoskeletal,darkolivegreen,DORSOPATHIES,5077,391910
721.2,Spondylosis with myelopathy,720-724.99,Both,1,1,14,musculoskeletal,darkolivegreen,DORSOPATHIES,190,391910
721.8,Other allied disorders of spine,720-724.99,Both,1,1,14,musculoskeletal,darkolivegreen,DORSOPATHIES,353,391910
722,Intervertebral disc disorders,720-724.99,Both,1,0,14,musculoskeletal,darkolivegreen,DORSOPATHIES,9242,391910
722.1,Displacement of intervertebral disc,720-724.99,Both,1,1,14,musculoskeletal,darkolivegreen,DORSOPATHIES,513,391910
722.3,Schmorl's nodes,720-724.99,Both,1,1,14,musculoskeletal,darkolivegreen,DORSOPATHIES,33,391910
722.6,Degeneration of intervertebral disc,720-724.99,Both,1,1,14,musculoskeletal,darkolivegreen,DORSOPATHIES,2846,391910
722.7,Intervertebral disc disorder with myelopathy,720-724.99,Both,1,1,14,musculoskeletal,darkolivegreen,DORSOPATHIES,1,391910
722.8,Postlaminectomy syndrome,720-724.99,Both,1,1,14,musculoskeletal,darkolivegreen,DORSOPATHIES,69,391910
722.9,Other and unspecified disc disorder,720-724.99,Both,1,1,14,musculoskeletal,darkolivegreen,DORSOPATHIES,4435,391910
723,Other disorders of cervical region,720-724.99,Both,1,0,14,musculoskeletal,darkolivegreen,DORSOPATHIES,521,391910
723.1,Torticollis,720-724.99,Both,1,1,14,musculoskeletal,darkolivegreen,DORSOPATHIES,107,391910
724,Other and unspecified disorders of back,720-724.99,Both,1,0,14,musculoskeletal,darkolivegreen,DORSOPATHIES,2079,391910
724.1,Disorders of sacrum,720-724.99,Both,1,1,14,musculoskeletal,darkolivegreen,DORSOPATHIES,404,391910
724.2,Disorders of coccyx,720-724.99,Both,1,1,14,musculoskeletal,darkolivegreen,DORSOPATHIES,407,391910
724.8,Other symptoms referable to back,720-724.99,Both,1,1,14,musculoskeletal,darkolivegreen,DORSOPATHIES,63,391910
724.9,Other unspecified back disorders,720-724.99,Both,1,1,14,musculoskeletal,darkolivegreen,DORSOPATHIES,1619,391910
726,Peripheral enthesopathies and allied syndromes,725-729.99,Both,1,0,14,musculoskeletal,darkolivegreen,"Rheumatism, Excluding The Back",14983,378709
726.1,Enthesopathy,725-729.99,Both,1,1,14,musculoskeletal,darkolivegreen,"Rheumatism, Excluding The Back",9668,378709
726.2,Synoviopathy,725-729.99,Both,1,1,14,musculoskeletal,darkolivegreen,"Rheumatism, Excluding The Back",334,378709
726.3,Bursitis,725-729.99,Both,1,1,14,musculoskeletal,darkolivegreen,"Rheumatism, Excluding The Back",858,378709
726.4,Calcaneal spur; Exostosis NOS,725-729.99,Both,1,1,14,musculoskeletal,darkolivegreen,"Rheumatism, Excluding The Back",37,378709
